title,snippet,link,position,date
foontin - Twitch,"foontin streams live on Twitch! Check out their videos, sign up to chat, and join their community.Ve los clips de foontin en Twitch. ¡Ve el stream de Dota 2 y otro contenido en vivo!fountn · Home · About · Schedule · Videos · Chat ...Human embodiment of a gnome child.",https://www.twitch.tv/foontin,0,2022-07-21 13:04:40
We Finna Keep Foontin the Fianls **MSQ Spoilz** - YouTube,Broadcasted live on Twitch -- Watch live at https://www.twitch.tv/inidikaruu. ... We Finna Keep Foontin the Fianls **MSQ Spoilz**. No viewsNo views.,https://www.youtube.com/watch?v=asuk8tpYmQw,1,2022-07-21 13:04:40
Heritage Auctions Search [1067 3107],"Jeff Jones Spasm Complete 3-Page Story ""The Bridge"" Original Art (Last Gasp, ... Robert Crumb Hup #4 ""Mr. Natural & Flakey Foont in A Bitchin' Bod"" Page 6 ...Jeff Jones Spasm Complete 3-Page Story ""The Bridge"" Original Art (Last Gasp, ... Robert Crumb Hup #4 ""Mr. Natural & Flakey Foont in A Bitchin' Bod"" Page 6 ...",https://www.ha.com/c/search-results.zx?No=1451&N=1067+3107,2,2022-07-21 13:04:40
Beats: Now and Then - John Grady by Senile Monk Press - Issuu,5 Jun 2022 — ... red hair and beard twitching and shaking as he laughed in glee. ... and R. Crumb's “Mr Natural” and “Flaky Foont in Smogville Blues.,https://issuu.com/mikenelson68/docs/final_john_grady_beats_complete,3,2022-07-21 13:04:40
"Full text of ""The New York Clipper (September 1914)""","... and he mikes one feel quite nervous watching the twitch- ing of the hands ... Savoy, FoONTAt.v, Colonial, PaiNOSss, Crxs- cumt, OnrnErv, Royal, Palace, ...",https://archive.org/stream/clipper62-1914-09/clipper62-1914-09_djvu.txt,4,2022-07-21 13:04:40
Graphic Novels Reading Rainbow - Tumblr,"... “Music for Monsters III”, “Twitch City”, and “Out o' Space”. ... be when Mr. Natural told Flankey Foont, in order to fix his problem he should take LSD, ...",https://graphicnovelsreadingrainbow.tumblr.com/page/3,5,2022-07-21 13:04:40
AIRPLAY - World Radio History,27 Jun 2003 — former talk WKRK Detroit duo Kramer & Twitch for mornings. Carter stays on as producer. Across ... Pharrell Featuring lay2 Foontin.,https://worldradiohistory.com/Archive-All-Music/Billboard/Billboard-Airplay/2003/BBAM-2003-06-27.pdf,6,2022-07-21 13:04:40
"The Sydney Morning Herald from Sydney, New South Wales ...","(low Foon Tin. who waa convicted before Mr. dates, n.M-, on a charge of being a ... n.f'L elter twitch Panela. with 2-v""lt ""''"" ' The .et le at the ...",https://www.newspapers.com/newspage/122339076/,7,2022-07-21 13:04:40
feen (@thedragonfeeney) / Twitter,Two Time Twitch Partner | Entertainment Streamer | Dice Collector | Pizza Friday | smiles you can hear | thedragonfeeneybiz@gmail.com.,https://twitter.com/thedragonfeeney?lang=en,8,2022-07-21 13:04:40
